-idInter,lotEtape,typePlancherBas,structurePlancherBas,resTypeIsoPlancherBas,-risque,-solution
1,plancherBas,"localNonChauffe,videSanAcc,videSanNonAcc",*,"sousDalle,projete,projeteRobot,panneauxSousDale",Pont thermique,L'entreprise doit traiter les refends du local non chauffé ou du vide sanitaire accessible  en assurant une retombée d'isolation de 40cm avec une résistance de 3 m².K/W.
2,plancherBas,localNonChauffe,*,*,Pont thermique & sécurité,"Assurez-vous que l'entreprise prévoie, dans les locaux chauffés, que les équipements techniques (boite de dérivation, réseaux…) restent accessibles. "
3,plancherBas,"localNonChauffe,videSanAcc,videSanNonAcc",*,*,Pathologie,"Vérifiez que l'entreprise maintienne toutes les ouvertures de ventilation (grille, soupiraille…). "
4,plancherBas,"localNonChauffe,videSanAcc,videSanNonAcc,extetieur",*,*,Etanchéité à l'air,"Pour le plancher bas, prévoir l'utilisation d'accessoires adaptés pour le traitement de l'étanchéité à l'air des pénétrations y compris conduits de fumée (œillets, ruban adhesif, mastic…)."
5,plancherBas,"localNonChauffe,extetieur",*,*,Pont thermique,"Dans le cas de passage de réseaux en sous-face du plancher, assurez-vous que l'entreprise prévoie le dévoiement des réseaux. "
6,plancherBas,*,plancherBois ,*,Etanchéité à l'air,"Dans le cas d'un plancher en bois, vérifiez que l'entreprise prévoie la mise en œuvre d'un pare vapeur pour assurer l'étanchéité à l'air."
